Title,Description,URL,Annotation
Kamala Harris mocks Donald Trump as she joins long list of politicians to cameo on 'Saturday Night Live',"During her cameo, Harris appeared to poke fun at a recent video of Trump struggling to climb into a garbage truck at a campaign event.",https://www.businessinsider.com/kamala-harris-mocks-donald-trump-surprise-saturday-night-live-cameo-2024-11,Campaign
The blue wall was Kamala Harris' clearest path to the White House. Here's why it faded away.,Vice President Harris sought to bring together the coalition that had elected President Biden. But an array of challenges proved to be insurmountable.,https://www.businessinsider.com/harris-trump-blue-wall-democrats-suburban-voters-unions-2024-11,Campaign
"What we know about Trump, Harris medical records after VP releases doctor's report",Kamala Harris recently released her medical records but Donald Trump has yet to do so.,https://abcnews.go.com/Health/trump-harris-medical-records-after-vp-releases-doctors/story?id=114822811,Campaign
Harris paints Trump as a national threat in testy Fox News interview,VP Kamala Harris blasted Donald Trump in a Fox News interview with Bret Baier.,https://abcnews.go.com/Politics/harris-paints-trump-national-threat-testy-fox-news/story?id=114869202,Campaign
Harris expected to take advantage of Kelly's critical comments of Trump at town hall,Vice President Kamala Harris will answer questions from voters Wednesday night at a CNN town hall.,https://abcnews.go.com/Politics/harris-expected-advantage-kellys-critical-comments-trump-cnn/story?id=115069432,Campaign
Harris revives message around democracy as Trump escalates rhetoric. Will it work?,"Kamala Harris shunted Joe Biden's messaging on democracy when she took over as Democrats' nominee, but now she's reviving attacks amid Donald Trump's escalating rhetoric.",https://abcnews.go.com/Politics/harris-revives-message-democracy-trump-escalates-rhetoric-work/story?id=114908724,Campaign
Harris to have moderated conversations with Liz Cheney in 3 battleground states,"Vice President Kamala Harris will do a series of moderated conversations with former Rep. Liz Cheney in the battleground states of Pennsylvania, Michigan and Wisconsin.",https://abcnews.go.com/Politics/harris-moderated-conversations-liz-cheney-3-battleground-states/story?id=114990344,Campaign
"Beshear fleshes out difference between Biden, Harris agendas",Andy Beshear offered a contrast between the agendas of President Joe Biden and Kamala Harris after the vice president struggled to paint clear differences.,https://abcnews.go.com/Politics/beshear-fleshes-difference-biden-harris-agendas/story?id=114751516,Campaign
"Harris, Obama to campaign together for 1st time at star-studded Georgia rally",Vice President Kamala Harris will campaign with former President Barack Obama for the first time Thursday night in must-win Georgia at a star-studded rally.,https://abcnews.go.com/Politics/harris-obama-campaign-1st-time-star-studded-georgia/story?id=115107333,Campaign
WATCH: Harris tries to woo unhappy Republican voters as Trump doubles down on his base,"ABC News’ Jon Karl breaks down how Vice President Kamala Harris and former President Donald Trump are trying to solidify votes, with just 13 days until the election.",https://abcnews.go.com/GMA/News/video/harris-woo-unhappy-republican-voters-trump-doubles-base-115057589,Campaign
Harris maintains polling lead among young voters as both candidates ramp up appeals,Former President Donald Trump and Vice President Kamala Harris have ramped up their courtship of young voters to push their candidacies over the finish line.,https://abcnews.go.com/Politics/harris-maintains-lead-young-voters-candidates-ramp-appeals/story?id=115273335,Campaign
"With 2024 race so tight, a reminder how few votes decided the 7 swing states in 2020",All signs point to another close election with Vice President Kamala Harris and former President Donald Trump neck-and-neck in national and battleground state polls.,https://abcnews.go.com/Politics/2024-race-tight-reminder-votes-decided-7-swing/story?id=115398688,Campaign
"Harris works to appeal to Black men, a critical group for Democrats","For a second day this week, Vice President Kamala Harris is focusing on a key voting bloc that is a critical base fro the Democratic Party: Black men.",https://abcnews.go.com/Politics/harris-works-appeal-black-men-critical-group-democrats/story?id=114780568,Campaign
What is fascism? A look at the term being hurled at Donald Trump,"Former President Donald Trump has been hit with claims that he's a ""fascist"" from his former chief of staff,f John Kelly, and his opponent, Kamala Harris.",https://abcnews.go.com/Politics/fascism-term-hurled-donald-trump/story?id=115101505,Campaign
Half of Americans see Donald Trump as a fascist: POLL,"Half the country sees Donald Trump as a fascist in a new ABC News/Ipsos poll, amplifying concerns recently raised by Kamala Harris and past Trump administration members.",https://abcnews.go.com/Politics/donald-trump-fascist-concerns-poll/story?id=115083795,Campaign
Harris to deliver 'closing argument' in remarks on DC's Ellipse,"Vice President Kamala Harris is set to make her final case for her bid for the presidency on Washington, D.C.'s Ellipse on Tuesday.",https://abcnews.go.com/Politics/harris-deliver-closing-argument-remarks-dcs-ellipse/story?id=115222481,Campaign
Harris seizes on Trump's pledge to protect women 'whether they like it or not',"Vice President Kamala Harris slammed Donald Trump on Thursday, saying the former president's pledge to protect women was ""offensive to everybody.""",https://abcnews.go.com/Politics/harris-seizes-trumps-pledge-protect-women/story?id=115349240,Campaign
Harris distances herself from Biden's 'garbage' comment,"Kamala Harris continues to distance herself from Biden's ""garbage"" comment, telling ABC News she disagrees ""with any criticism of the people based on who they vote for.""",https://abcnews.go.com/Politics/harris-distances-bidens-garbage-comment-strongly-disagree-criticizing/story?id=115313099,Campaign
Harris steps out of friendly media confines to do interview with Fox News' Bret Baier,Kamala Harris will sit down with Fox News' Bret Baier Wednesday as she steps out of the comfort of what has so far been a relatively friendly series of interviews.,https://abcnews.go.com/Politics/harris-steps-friendly-media-confines-interview-fox-news/story?id=114818537,Campaign
"Economic concerns are top of voters' minds, but Kamala Harris is choosing a different path for her closing argument","Kamala Harris is betting voters can hear two messages at once, but she is leaning hard into anti-Trump attacks in the final weeks before Election Day.",https://www.businessinsider.com/harris-closing-message-trump-john-kelly-fascist-2024-10,Campaign
How Trump won the biggest Muslim-majority city in America,"Kamala Harris' humiliating loss in Dearborn, Michigan can only be blamed on the Biden administration and her own campaign's failures.",https://www.msnbc.com/opinion/msnbc-opinion/trump-harris-arab-muslim-voters-dearborn-michigan-rcna179385,Campaign
Full transcript: Vice President Kamala Harris interviewed by NBC News' Hallie Jackson,"Vice President Kamala Harris was interviewed Tuesday by NBC News' Hallie Jackson at the Naval Observatory in Washington, D.C.",https://www.nbcnews.com/politics/2024-election/transcript-president-kamala-harris-interview-nbc-news-hallie-jackson-rcna176330,Campaign
Harris has no current plans to campaign with Biden before Election Day,"With just two weeks left in the 2024 campaign, there currently are no plans for Kamala Harris to appear on the trail with Joe Biden before Election Day.",https://www.nbcnews.com/politics/2024-election/kamala-harris-no-current-plans-campaign-biden-election-day-rcna176254,Campaign
Trump's closing argument and McDonald's E.coli outbreak: Morning Rundown,"Kamala Harris, CNN town hall, fascist, McDonald's E. coli outbreak onions, Boeing strike, Ozempic, Grizzly 399, Gaza refugees, holiday gift ideas",https://www.nbcnews.com/news/trumps-campaign-mcdonalds-ecoli-morning-rundown-rcna176985,Campaign
Trump threatens to drown out his closing message in the final days of the election,"Kamala Harris' final events have been far more disciplined, while Donald Trump's have often been eclipsed by his off-the-cuff comments and his allies' crude remarks.",https://www.nbcnews.com/politics/2024-election/trump-threatens-drown-closing-message-final-days-election-rcna177135,Campaign
Harris will ask voters to 'turn the page' on Trump era at the site of his Jan. 6 speech,"Kamala Harris will hold a rally Tuesday near the White House — the site where Donald Trump spoke on Jan. 6, 2021.",https://www.nbcnews.com/politics/2024-election/harris-will-ask-voters-turn-page-trump-era-site-jan-6-speech-rcna177669,Campaign
"With Obama, 'All the Smoke' and 'huddle-ups,' Harris ramps up outreach to Black men","Vice President Kamala Harris’ campaign this week is launching its clearest effort yet to target Black men, announcing a new set of policy proposals.",https://www.nbcnews.com/politics/2024-election/obama-harris-outreach-black-men-rcna175297,Campaign
Harris faces historic challenge in running as a sitting VP: From the Politics Desk,"Kamala Harris is the third presidential nominee in the last half-century to run as a sitting vice president, presenting unique challenges for her campaign.",https://www.nbcnews.com/politics/kamala-harris-historic-challenge-running-sitting-vp-politics-desk-rcna175604,Campaign
Harvey Weinstein diagnosed with cancer and LeBron could make NBA history with son Bronny: Morning Rundown,"LeBron James, Bronny James, Los Angeles Lakers, Kamala Harris, Donald Trump, Elon Musk lottery, Harvey Weinstein, Robert Roberson testimony, The Vessel New York City, Central Park Five",https://www.nbcnews.com/news/harvey-weinstein-cancer-lebron-bronny-james-morning-rundown-rcna176531,Campaign
Battleground state election lawsuits and IRS raises income tax brackets: Morning Rundown,"Kamala Harris interview, Donald Trump, John Kelly, JD Vance, IRS income tax brackets for 2025, bird flu cases in Washington, McDonald's quarter pounder, Liam Payne, Maya Henry",https://www.nbcnews.com/news/election-lawsuits-irs-income-tax-brackets-morning-rundown-rcna176728,Campaign
"In Michigan, Democratic enthusiasm competes with disaffection","As she faces dissent from parts of the traditional Democratic base, Kamala Harris is counting on expanded support from suburban voters and former Republicans.",https://www.nbcnews.com/politics/2024-election/michigan-democratic-disaffection-kamala-harris-israel-lebanon-rcna176508,Campaign
Howard student journalists brace for their biggest assignment: Election night with Harris,"Kamala Harris will spend election night at Howard, University her alma mater and a prominent HBCU. Staff of student media organizations are prepping for the big assignment.",https://www.nbcnews.com/news/nbcblk/howard-student-journalists-prepare-cover-election-night-harris-rcna177893,Campaign
Harris and Trump's closing arguments and ancient Mayan city discovered: Morning Rundown,"Kamala Harris, Donald Trump, Joe Biden, floating garbage, Tony Hinchcliffe, health insurance, North Korea, Russia-Ukraine War, World Series Game 4, Teri Garr, Jeopardy",https://www.nbcnews.com/news/harris-speech-ellipse-ancient-mayan-city-morning-rundown-rcna177973,Campaign
Trump continues false claims about FEMA response in North Carolina,"Latest news and live updates on the 2024 campaign as Donald Trump heads to North Carolina and Kamala Harris visits Pennsylvania, Wisconsin and Michigan.",https://www.nbcnews.com/politics/2024-election/live-blog/harris-trump-election-live-updates-rcna176305,Campaign
Texas 'shaken baby syndrome' execution and One Direction's Liam Payne dies: Morning Rundown,"Robert Roberson, Texas execution, Liam Payne death, Argentina hotel, Russian propaganda, Kamala Harris Fox News interview, early voting data, Disney tickets",https://www.nbcnews.com/news/texas-shaken-baby-syndrome-liam-payne-dies-morning-rundown-rcna175866,Campaign
Trump and Harris hold dueling events in Texas,The latest news and live updates on the 2024 election. Follow Donald Trump and Kamala Harris in Texas and Barack Obama and JD Vance in North Carolina.,https://www.nbcnews.com/politics/2024-election/live-blog/harris-trump-election-live-updates-rcna176309,Campaign
Beyoncé expected to perform at Harris rally in Houston,"Pop superstar Beyoncé will appear with Vice President Kamala Harris at her event in Houston, Texas on Friday evening, according to three sources familiar with the plans.",https://www.nbcnews.com/politics/2024-election/beyonce-expected-perform-harris-rally-houston-rcna177048,Campaign
Election guardrails in 2024 and lost Chopin waltz discovered: Morning Rundown,"Election laws, Donald Trump, Kamala Harris, Puerto Rico, Tony Hinchcliffe, Puerto Rico joke, McDonald's, E. coli outbreak, Jay Johnston, JP Morgan lawsuits",https://www.nbcnews.com/news/election-guardrails-2024-ecoli-mcdonalds-morning-rundown-rcna177758,Campaign
Kamala Harris' case for American democracy,"Kamala Harris’ speech at the Ellipse on Tuesday evening was a strong showing for the Democratic candidate, touching on democracy, the economy and abortion rights.",https://www.msnbc.com/opinion/msnbc-opinion/kamala-harris-ellipse-speech-pushed-back-trumps-division-rcna177932,Campaign
Harris campaign leans into her HBCU roots,Vice President Kamala Harris graduated from Howard University with her bachelor's degree in 1986.,https://www.cbsnews.com/news/harris-to-spend-election-night-at-howard-university-campaign-leans-into-hbcu-roots/,Campaign
"Transcript: ""Face the Nation"" excerpt of Norah O'Donnell interview with Vice President Kamala Harris","""CBS Evening News"" anchor Norah O'Donnell interviewed Vice President Kamala Harris in Kalamazoo, Michigan.",https://www.cbsnews.com/news/kamala-harris-interview-transcript-norah-odonnell-face-the-nation-excerpt/,Campaign
Vice President Kamala Harris agrees to Fox News interview,"Fresh off her media blitz, Vice President Kamala Harris has now agreed to sit down for an interview with Fox News on Wednesday. Sophia Cai, national politics reporter at Axios, and Gram Slattery, national political reporter for Reuters, join ""America Decides""…",https://www.cbsnews.com/video/vice-president-kamala-harris-agrees-to-fox-news-interview/,Campaign
"Kamala Harris promises unity, bipartisanship in ""closing argument"" speech","Vice President Kamala Harris laid out the ""closing argument"" for her campaign Tuesday night in a speech from Washington, promising unity and bipartisanship in her administration if she's elected. CBS News political director Fin Gómez has the latest on the Har…",https://www.cbsnews.com/video/kamala-harris-promises-unity-bipartisanship-in-closing-argument-speech/,Campaign
Kamala Harris focuses on reproductive rights at Nevada rally,"As Vice President Kamala Harris' campaign comes down the home stretch, she's continuing to slam former President Trump on issues like abortion. CBS News correspondent Lilia Luciano has more.",https://www.cbsnews.com/video/kamala-harris-focuses-on-reproductive-rights-at-nevada-rally/,Campaign
Harris responds to Trump's MSG rally and says he's 'fixated' on dividing the country,Former President Barack Obama and singer Bruce Springsteen will appear in Philadelphia today as Vice President Kamala Harris continues to lean on star power in the final days of the campaign.,https://www.nbcnews.com/politics/2024-election/live-blog/trump-harris-obama-springsteen-election-live-updates-rcna177527,Campaign
Secretive Democratic super PAC pumps $30 million into Spanish-language TV ads,"A secretive Democratic super PAC has been quietly running a massive Spanish-language ad campaign in support of Vice President Kamala Harris, pumping tens of millions of dollars into trying to reach persuadable Latino voters.",https://www.nbcnews.com/politics/2024-election/secretive-democratic-super-pac-pumps-30-million-spanish-language-tv-ad-rcna177101,Campaign
Kamala Harris on her first priority as president,"CBS News' Norah O'Donnell talks with Kamala Harris about women's healthcare, and a prospective return of Donald Trump to the White House.",https://www.cbsnews.com/news/kamala-harris-on-abortion-first-priority-as-president-restoring-roe-v-wade/,Campaign
Comparing Kamala Harris' and Hillary Clinton's performances against Trump,Hillary Clinton attempted to shatter the highest glass ceiling in U.S. politics and went up against now-President-elect Donald Trump in 2016. CBS News deputy director of elections and data analytics Kabir Khanna compares her performance with Vice President Ka…,https://www.cbsnews.com/video/comparing-kamala-harris-hillary-clintons-performances-against-trump/,Campaign
Takeaways from Kamala Harris' interview with Fox News,"Vice President Kamala Harris' interview with Fox News is drawing intense reactions from both sides of the aisle. Brakkton Booker, national political correspondent for Politico, and Fin Gómez, CBS News political director, join ""America Decides"" to weigh in on …",https://www.cbsnews.com/video/kamala-harris-fox-news-interview-takeaways/,Campaign
Kamala Harris on her first priority as president,"""CBS Evening News"" anchor and managing editor Norah O'Donnell traveled with Vice President Kamala Harris on the campaign trail over two days, in Texas and Michigan. They talked about what Harris calls her first priority if elected president: signing into law …",https://www.cbsnews.com/video/kamala-harris-on-her-first-priority-as-president/,Campaign
Kamala Harris blanketing Pennsylvania on eve of Election Day,Vice President Kamala Harris is cross-crossing Pennsylvania Monday as she works to shore up support in the pivotal battleground state in her final day on the campaign trail. CBS News campaign reporter Aaron Navarro has more.,https://www.cbsnews.com/video/kamala-harris-blanketing-pennsylvania-on-eve-of-election-day/,Campaign
Harris says ‘of course’ her team is prepared if Trump declares victory before votes are counted,"In an interview with NBC News’ Hallie Jackson on Tuesday, Vice President Kamala Harris said she's preparing for the possibility that former President Donald Trump declares victory before the votes are counted in this next month's election.",https://www.nbcnews.com/politics/2024-election/harris-says-course-team-prepared-trump-declares-victory-votes-are-coun-rcna176674,Campaign
Harris to hold election night event at Howard University,"Vice President Kamala Harris, the Democratic presidential nominee, plans to spend election night at her alma mater, Howard University in Washington, D.C., according to three people familiar with the planning.",https://www.nbcnews.com/politics/2024-election/kamala-harris-election-night-event-howard-university-washington-dc-rcna177874,Campaign
Trump cuts short his town hall Q&A in favor of songs from rally playlist,"Vice President Kamala Harris' campaign seized on the moment with a social media post saying the former president looked ""confused.""",https://www.cbsnews.com/news/trump-town-hall-interrupted-playlist-pennsylvania/,Campaign
Harris has cash edge over Trump in latest fundraising numbers,Vice President Kamala Harris' campaign raised more than three times as much money as former President Donald Trump in September.,https://www.cbsnews.com/news/harris-trump-campaigns-fundraising-fec-september/,Campaign
Kamala Harris’ campaign didn’t ignore working class voters,There are a couple of problems with Bernie Sanders’ argument that Democrats have abandoned the working class. The most obvious and glaring is that it simply isn’t true.,https://www.msnbc.com/opinion/msnbc-opinion/biden-harris-working-class-vote-trump-election-rcna179186,Campaign
"Harris leading Trump among women, exit poll shows","Vice President Kamala Harris is leading former President Donald Trump among women nationally, a new CBS News exit poll shows. John Dickerson breaks down the numbers.",https://www.cbsnews.com/video/harris-leading-trump-among-women-exit-poll-shows/,Campaign
Abortion rights support didn't always translate into Harris support —exit poll analysis,"Americans voted to protect abortion access in seven states, but support for those measures outpaced support for Kamala Harris, who made abortion rights central to her campaign.",https://www.cbsnews.com/news/abortion-rights-exit-poll-kamala-harris-2024/,Campaign
"238 doctors, health care providers call on Trump to release medical records",The letter comes as Vice President Kamala Harris is criticizing former President Donald Trump for a lack of transparency about his health.,https://www.cbsnews.com/news/trump-health-records-doctors-for-harris/,Campaign
"Harris campaigns in Michigan, works to shore up support with Black men","Vice President Kamala Harris on Tuesday was campaigning in the battleground state of Michigan, where she was looking to boost support among Black men. Ed O'Keefe has more.",https://www.cbsnews.com/video/harris-campaigns-in-michigan-works-to-shore-up-support-with-black-men/,Campaign
"Harris, Cheney paint Trump as threat to democracy in Pa. campaign event","Vice President Kamala Harris and former Republican Congressperson Liz Cheney launched a three-state campaign tour in Chester County, Pennsylvania, on Monday.",https://www.cbsnews.com/philadelphia/news/kamala-harris-chester-county-pennsylvania-liz-cheney/,Campaign
"""Progress 2028"" may look like Democrats' ""Project 2025,"" but it's not","A conservative nonprofit has launched a campaign to attribute policies to Vice President Kamala Harris through a deceptive website and platform called ""Progress 2028.""",https://www.cbsnews.com/news/progress-2028-not-kamala-harris-project-2025/,Campaign
"Oct 30: CBS News 24/7, 1pm ET","Vice President Kamala Harris delivers remarks in Raleigh, North Carolina; U.S. responds to Israel issuing evacuation for southern area of Lebanon.",https://www.cbsnews.com/video/103024-cbs-news-247-episode-2/,Campaign
Mideast conflict has some Democrats in Michigan turning away from Harris,"The Israel-Hamas war is a major vulnerability for Vice President Kamala Harris, with some uncommitted Democratic voters considering leaving the presidential box on their ballots blank.",https://www.cbsnews.com/news/mideast-conflict-has-some-democrats-in-michigan-turning-away-from-harris/,Campaign
Harris focuses on Nikki Haley's primary voters in closing weeks of campaign,Among the voters Kamala Harris is pursuing in the final weeks of the 2024 campaign are those who voted for Nikki Haley over Trump in the GOP primaries.,https://www.cbsnews.com/news/harris-michigan-nikki-haley-primary-voters/,Campaign
"Harris speech at Ellipse to offer ""a different path"" than Trump","Vice President Kamala Harris will deliver remarks at the same spot Trump inspired his supporters to march to Capitol on Jan. 6, 2021.",https://www.cbsnews.com/news/kamala-harris-speech-ellipse-donald-trump-2024-election/,Campaign
"Harris ""strongly"" disagrees with criticism of people ""based on who they vote for,"" after Biden's ""garbage"" comment","In response to a question about Biden's ""garbage"" comment, Kamala Harris said she ""strongly"" disagrees with ""any criticism of people based on who they vote for.""",https://www.cbsnews.com/news/harris-responds-biden-garbage-comment/,Campaign
"Harris says election will ""decide fate of our nation for generations to come""","Vice President Kamala Harris, who campaigned in the Delaware Valley last week, spoke at a Philadelphia church Sunday morning before holding a rally later tonight.",https://www.cbsnews.com/philadelphia/news/kamala-harris-philadelphia-campaign-rally/,Campaign
"Harris makes surprise appearance on ""Saturday Night Live""","Vice President Kamala Harris made a surprise appearance on ""Saturday Night Live,"" playing herself as the mirror-image double of Maya Rudolph's version of her.",https://www.cbsnews.com/news/harris-surprise-appearance-saturday-night-live/,Campaign
"On economic and business interests, isn't the 2024 choice obvious?","Plenty of voters' sole focus is on the economy, business interests, and their own wallets. For them, Kamala Harris should have a sizable 2024 advantage.",https://www.msnbc.com/rachel-maddow-show/maddowblog/economic-business-interests-isnt-2024-choice-obvious-rcna176174,Campaign
"A tale of two closing messages: Harris offers patriotism, rejects Trump’s ‘chaos’","As Trump slams the country as a ""garbage can,"" Kamala Harris declared at the Ellipse, ""The United States of America is the greatest idea humanity ever devised.”",https://www.msnbc.com/rachel-maddow-show/maddowblog/tale-two-closing-messages-harris-offers-patriotism-rejects-trumps-chao-rcna177986,Campaign
Kamala Harris and this Election Day represent the promise of Howard University,"It is only fitting that Vice President Kamala Harris, who graduated from Howard University, will be there Election Night to watch returns.",https://www.msnbc.com/opinion/msnbc-opinion/kamala-harris-howard-university-election-headquarters-rcna176696,Campaign
Harris and Trump push different kinds of closing messages with 3 weeks to go,"In a toss-up race, Kamala Harris is going to great lengths to reach out beyond her party’s base. Donald Trump’s approach is ... different.",https://www.msnbc.com/rachel-maddow-show/maddowblog/harris-trump-push-different-kinds-closing-messages-3-weeks-go-rcna175272,Campaign
The Democrats' Black voter crisis is overblown,"Kamala Harris is not at risk of losing huge number of Black men to Donald Trump if you look at the right polls and trends, political scientists say.",https://www.msnbc.com/opinion/msnbc-opinion/harris-black-men-voters-trump-polls-rcna175807,Campaign
