Title,Description,URL,Annotation
Harris goes on offensive after Trump says he’s the ‘father of IVF’,"Donald Trump's spokesperson said it was a ""joke"" when he claimed to be the ""father of IVF."" Kamala Harris clearly didn't find it funny.",https://www.msnbc.com/rachel-maddow-show/maddowblog/harris-goes-offensive-trump-says-s-father-ivf-rcna175912,Campaign
"Women drive big advantage for Harris among young voters, with men divided in the latest poll","Half of registered voters under 30 years old plan to vote for Vice President Kamala Harris and one-third are lining up with former President Donald Trump — relatively unchanged from a previous survey in August, according to the new NBC News Stay Tuned Gen Z P…",https://www.nbcnews.com/politics/2024-election/poll-women-drive-big-advantage-harris-young-voters-men-divided-rcna176321,Campaign
Harris spars with Fox News host and says she would not be a 'continuation' of Biden,"In a combative interview with Fox News, Kamala Harris said in the most emphatic terms to date that, if she wins the election, she would pursue an independent presidency that would not be a repeat of President Joe Biden’s nearly four years in office.",https://www.nbcnews.com/politics/2024-election/harris-spars-fox-news-host-says-not-continuation-biden-rcna175742,Campaign
"Harris campaign hits key states, Trump to rally in Wisconsin","Vice President Kamala Harris is campaigning in three key states a day after delivering what her campaign billed as her closing argument in a speech yesterday in Washington D.C. First, the vice president will deliver remarks in Raleigh, North Carolina, in the …",https://www.nbcnews.com/politics/2024-election/live-blog/kamala-harris-donald-trump-rally-election-live-updates-rcna177529,Campaign
"""Veep"" creator on comparisons between Kamala Harris and Veep's Selina Meyers","From the moment Kamala Harris became the Democratic nominee, fans of the hit HBO show ""Veep"" drew comparisons to lead character Selina Meyer. But one person who isn't laughing at the comparison is the show's creator, Armando Iannucci.",https://www.cbsnews.com/video/veep-creator-on-comparisons-between-kamala-harris-and-veeps-selina-meyers/,Campaign
Trump campaigns in Pennsylvania while Harris holds events in Georgia,"Former President Donald Trump campaigned in Pennsylvania on Sunday, serving McDonald's fries to supporters outside of Philadelphia. Vice President Kamala Harris meanwhile attended church with Stevie Wonder in Georgia. Caitlin Huey-Burns reports.",https://www.cbsnews.com/video/trump-campaigns-in-pennsylvania-while-harris-holds-events-in-georgia/,Campaign
"How Trump, Harris are doing in battleground states that could decide election",Former President Donald Trump and Vice President Kamala Harris are participating in town halls in battleground states Wednesday where a close race remains for both candidates. CBS News' Nikole Killion reports.,https://www.cbsnews.com/video/latest-poll-on-trump-harris-in-battleground-stateshow-trump-harris-are-doing-in-battleground-states-that-could-decide-election/,Campaign
Harris campaign co-chair on strategy heading into Election Day,"Election Day is 12 days away. So what is Vice President Kamala Harris' strategy over the coming days? Mitch Landrieu, co-chair of the Harris-Walz campaign, joins ""America Decides"" to discuss.",https://www.cbsnews.com/video/harris-campaign-co-chair-strategy-heading-into-election-day/,Campaign
Kamala Harris turns to her faith in outreach to Black voters,"As part of a faith outreach, Vice President Kamala Harris appeared at two Atlanta churches last Sunday, and she told CNN that she was ""raised to believe in a loving God.""",https://www.cbsnews.com/news/kamala-harris-faith-black-voter-outreach/,Campaign
Kemp discusses relationship with Trump as tight Georgia race against Harris remains,Georgia Gov. Brian Kemp is weighing in on his relationship with Donald Trump as efforts from the former president's campaign and Vice President Kamala Harris' campaign to swing Georgia ramp up. CBS News' Nikole Killion reports.,https://www.cbsnews.com/video/kemp-discusses-relationship-with-trump-as-tight-georgia-race-against-harris-remains/,Campaign
"Why Harris needs Latino voters in Arizona, Nevada",Vice President Kamala Harris is visiting Arizona and Nevada where Latino voters could help her campaign win both battleground states. CBS News' Nidia Cavazos breaks down the influence of Latino voters in the West.,https://www.cbsnews.com/video/why-harris-needs-latino-voters-in-arizona-nevada/,Campaign
Harris campaign tries to get more Black male voter support before Election Day,"Vice President Kamala Harris' campaign is doing more for support among Black male voters. Khalil Thompson, the executive director of Win With Black Men, joins CBS News with more on the efforts.",https://www.cbsnews.com/video/harris-campaign-tries-to-get-more-black-male-voter-support-before-election-day/,Campaign
Kamala Harris trying to appeal to young voters in final election push,"Vice President Kamala Harris was back in Michigan Monday night where she made a special appeal to young voters, but was also interrupted by a group protesting the war in Gaza. CBS News campaign reporter Nidia Cavazos has more.",https://www.cbsnews.com/video/kamala-harris-trying-to-appeal-to-young-voters-in-final-election-push/,Campaign
"Durbin on Election Day 2024, Harris campaign final message",Illinois Democrat Sen. Dick Durbin tells CBS News he is confident in Vice President Kamala Harris' campaign efforts. Durbin also weighed in on some key Senate races that could impact the balance of power in Capitol Hill.,https://www.cbsnews.com/video/durbin-on-election-day-2024-harris-campaign-final-message/,Campaign
"How the Trump, Harris campaigns are feeling on Election Day 2024",The campaigns for Vice President Kamala Harris and former President Donald Trump have positive feelings about Election Day 2024. CBS News campaign reporter Jake Rosen and senior White House correspondent Weijia Jiang break down the campaign reactions.,https://www.cbsnews.com/video/how-the-trump-harris-campaigns-are-feeling-on-election-day-2024/,Campaign
Kamala Harris makes last appeal to Pennsylvania voters as Election Day begins,"With Election Day here, Vice President Kamala Harris made multiple stops  to energize voters in a pivotal battleground state. Campaign communications director Michael Tyler joins ""CBS Mornings Plus"" to talk about her closing strategy.",https://www.cbsnews.com/video/kamala-harris-makes-last-appeal-to-pennsylvania-voters-as-election-day-begins/,Campaign
"Trump, Harris both campaigning in Pennsylvania","Both Donald Trump and Kamala Harris are hitting the campaign trail in the battleground state of Pennsylvania Monday. CBS News' Anthony Salvanto, Jake Rosen and Nidia Cavazos have the latest on the race for the White House.",https://www.cbsnews.com/video/trump-harris-both-campaigning-in-pennsylvania/,Campaign
"Harris says Trump is ""increasingly unstable,"" weighs in on IVF comments",Vice President Kamala Harris took questions from reporters before heading to Pennsylvania for a campaign event. Harris touched on Donald Trump's latest comments about in vitro fertilization and commented on questions about the former president's cognitive abi…,https://www.cbsnews.com/video/harris-says-trump-is-increasingly-unstable-weighs-in-on-ivf-comments/,Campaign
Kamala Harris participating in audio town hall hosted by Charlamagne tha God,"Vice President Kamala Harris will be in Detroit Tuesday to tape an audio town hall with Charlamagne tha God, co-host of ""The Breakfast Club."" CBS News campaign reporter Nidia Cavazos has more.",https://www.cbsnews.com/video/kamala-harris-participating-in-town-hall-hosted-by-charlamagne-tha-god/,Campaign
"Harris, Cheney argue Trump will be dangerous to U.S.","Vice President Kamala Harris and former Rep. Liz Cheney, a Republican from Wyoming, are touring Pennsylvania, Michigan and Wisconsin where they are warning voters against reelecting former President Donald Trump. CBS News' Zak Hudak reports.",https://www.cbsnews.com/video/harris-cheney-argue-trump-will-be-dangerous-to-us/,Campaign
"How Trump, Harris are doing in battleground states that could decide election",Former President Donald Trump and Vice President Kamala Harris are participating in town halls in battleground states Wednesday where a close race remains for both candidates. CBS News' Nikole Killion reports.,https://www.cbsnews.com/video/how-trump-harris-are-doing-in-battleground-states-that-could-decide-election/,Campaign
New Harris ad aims to win over Black men in Pennsylvania,A new Kamala Harris ad is tailored to reach Black men in Pennsylvania — and any other man who may be wary of supporting a woman as the next president.,https://www.cbsnews.com/news/new-harris-ad-aims-to-win-over-black-men-in-pennsylvania/,Campaign
"Eye Opener: Harris, Trump ramp up events before Election Day","Ahead of Election Day, Vice President Kamala Harris and former President Donald Trump are ramping up their campaign events. Meanwhile, the New York Liberty win its first WNBA title. All that and all that matters in today's Eye Opener.",https://www.cbsnews.com/video/eye-opener-harris-trump-ramp-up-events-before-election-day/,Campaign
"Here's why Harris, Trump are campaigning in Texas","Vice President Kamala Harris and former President Donald Trump are both taping viral podcasts while in Texas, a solidly red state where each candidate will discuss issues that resonate with their bases. CBS News' Nancy Cordes and Libby Cathey report.",https://www.cbsnews.com/video/heres-why-harris-trump-are-campaigning-in-texas/,Campaign
Norah O'Donnell unpacks interview with Harris in Michigan,"In a new interview, Vice President Kamala Harris told ""CBS Evening News"" anchor and managing editor Norah O'Donnell that a second Trump term could be perilous for the country's national security. O'Donnell joins ""America Decides"" with more on the conversation.",https://www.cbsnews.com/video/norah-odonnell-unpacks-harris-michigan-interview/,Campaign
"Harris says she'd take a cognitive test; challenges Trump ""to take the same one""","Vice President Kamala Harris, responding to former President Donald Trump's claims about her IQ, said she would take a cognitive test — and ""would challenge him to take the same one.""",https://www.cbsnews.com/news/kamala-harris-interview-norah-odonnell-interview-cognitive-test/,Campaign
"Kamala Harris warns of ""chaos and division"" in a second Trump term","With the Capitol and White House behind her, Vice President Kamala Harris presented a vision for unity, warning against what she describes as a dangerous return to a Trump presidency.",https://www.cbsnews.com/video/kamala-harris-warns-of-chaos-and-division-in-a-second-trump-term/,Campaign
Trump and Harris make last campaign stops before Election Day,"As voters prepare to head to the polls, former President Donald Trump and Vice President Kamala Harris focus on critical battleground states. CBS News political contributors Terry Sullivan and Joel Payne break down the closing campaign strategies.",https://www.cbsnews.com/video/trump-and-harris-make-last-campaign-stops-before-election-day/,Campaign
Harris campaigns across Michigan,"Vice President Kamala Harris made multiple campaign stops in Michigan on Sunday. The Harris campaign also touted its ground game, with volunteers knocking on millions of doors across the battleground states. Nancy Cordes reports.",https://www.cbsnews.com/video/harris-campaigns-across-michigan/,Campaign
Harris rallies across Pennsylvania ahead of Election Day,"Vice President Kamala Harris is spending the entire day in battleground Pennsylvania, with big time star power at her rallies in Pittsburgh and Philadelphia. Weijia Jiang has more about her final messages to voters there.",https://www.cbsnews.com/video/harris-rallies-across-pennsylvania-ahead-of-election-day/,Campaign
How Harris and Trump are spending eve of Election Day,Vice President Kamala Harris and former President Donald Trump are spending the last hours of the 2024 presidential race making their final pitches at rallies in several battleground states. CBS News' Aaron Navarro and Skyler Henry have the latest.,https://www.cbsnews.com/video/how-harris-trump-spending-election-day-eve/,Campaign
"What Harris, Trump are doing in the West right before Election Day",Vice President Kamala Harris and former President Donald Trump are visiting the West just days before the Nov. 5 Election Day. CBS News political reporter Zak Hudak has more on the upcoming campaign moves.,https://www.cbsnews.com/video/what-harris-trump-are-doing-in-the-west-right-before-election-day/,Campaign
"Kamala Harris back in Pennsylvania, Musk gives nearly $75 million to Trump PAC","Kamala Harris on Wednesday is making her 11th trip to Pennsylvania since entering the race for president after making a pitch to Black male voters Tuesday on ""The Breakfast Club"" radio show. Meanwhile, Elon Musk has donated nearly $75 million to a political a…",https://www.cbsnews.com/video/kamala-harris-back-in-pennsylvania-musk-makes-75-million-donation-to-trump-pac/,Campaign
"Breaking down Kamala Harris' Fox News interview, Trump's town hall on Univision",Both Kamala Harris and Donald Trump tried to reach out beyond their bases Wednesday with Harris doing an interview with Fox News and Trump speaking with Latino voters at a Univision town hall. CBS News senior White House and political correspondent Ed O'Keefe…,https://www.cbsnews.com/video/breaking-down-kamala-harris-fox-news-interview/,Campaign
Why Kamala Harris is campaigning in Texas with race in homestretch,"Kamala Harris will be joined by Beyoncé at a rally in Houston, Texas, on Friday with just 11 days remaining until Election Day. CBS News congressional correspondent Scott MacFarlane has more on why Harris is campaigning in a non-battleground state with the ra…",https://www.cbsnews.com/video/why-kamala-harris-is-campaigning-in-texas-with-race-in-homestretch/,Campaign
Kamala Harris weighs in on John Kelly warnings about Donald Trump,Vice President Kamala Harris commented on recent reports quoting former Donald Trump chief of staff John Kelly. The former Marine Corps general warned The New York Times that Trump could try to lead as a dictator and linked him to fascism. CBS News campaign r…,https://www.cbsnews.com/video/kamala-harris-weighs-in-on-john-kelly-warnings-about-donald-trump/,Campaign
"Kamala Harris reacts to Trump saying he'll protect women ""whether the women like it or not""","Vice President Kamala Harris spoke to reporters in Wisconsin Thursday about former President Donald Trump's comments that he would protect women ""whether the women like it or not."" Harris said the remark speaks to how Trump thinks about women and their agency…",https://www.cbsnews.com/video/kamala-harris-speaks-to-reporters-with-5-days-left-before-election-day/,Campaign
"Kamala Harris campaign staff emotionally devastated after election loss, concession to Trump",Vice President Kamala Harris' campaign staff is coming to grips and trying to understand what went wrong in the wake of their loss to Donald Trump. CBS News campaign reporter Shawna Mizelle reports on that and Bernie Sanders' post-election criticism of the De…,https://www.cbsnews.com/video/kamala-harris-campaign-staff-devastated-following-election-loss-concession-to-trump/,Campaign
Latest on 2024 race with 15 days until Election Day,Former President Donald Trump and Vice President Kamala Harris are campaigning in a combined four battleground states on Monday with just 15 days until Election Day. CBS News' Weijia Jiang and Robert Costa have the latest.,https://www.cbsnews.com/video/2024-race-latest-15-days-until-election-day/,Campaign
Harris campaign trying to highlight negatives about Trump as campaign winds down,"With less than two weeks until Election Day, the tone of Vice President Kamala Harris' campaign is shifting to focus on criticisms of former President Donald Trump. CBS News campaign reporter Nidia Cavazos has more.",https://www.cbsnews.com/video/harris-campaign-trying-to-highlight-negatives-about-trump-as-campaign-winds-down/,Campaign
"Harris, Trump make final campaign pitches, plans for post-election scenarios","With 11 days until Election Day, Kamala Harris and Donald Trump are honing their messaging for remaining undecided voters. CBS News chief election and campaign correspondent Robert Costa has the latest.",https://www.cbsnews.com/video/harris-trump-make-final-campaign-pitches/,Campaign
"Kamala Harris keeps focus on Black male voters during appearance on ""The Breakfast Club""","Vice President Kamala Harris made an appearance on ""The Breakfast Club"" radio show Tuesday where she continued to make her pitch to Black male voters. CBS News campaign reporter Nidia Cavazos has more.",https://www.cbsnews.com/video/kamala-harris-keeps-focus-on-black-male-voters-during-appearance-on-the-breakfast-club/,Campaign
Breakdown of the 2024 presidential race with Election Day just weeks away,CBS News chief election and campaign correspondent Robert Costa gives a closer look at the final weeks of the presidential race between former President Donald Trump and Vice President Kamala Harris.,https://www.cbsnews.com/video/breakdown-of-the-2024-presidential-race-with-election-day-just-weeks-away/,Campaign
"Harris, Trump push for votes in Pennsylvania",Vice President Kamala Harris and former President Donald Trump are in Pennsylvania for a crucial push to gather voters in the battleground state before the November election. CBS News political director Fin Gómez has more.,https://www.cbsnews.com/video/harris-trump-push-for-votes-in-pennsylvania/,Campaign
Harris reacts to Trump comments about protecting women,"Vice President Kamala Harris weighed in on former President Donald Trump's comments about protecting women whether they ""like it or not."" This comes as both campaigns target younger voters. CBS News political director Fin Gómez reports.",https://www.cbsnews.com/video/harris-reacts-to-trump-comments-about-protecting-women/,Campaign
"Kamala Harris pledges to be president for all Americans after Biden's ""garbage"" gaffe","Vice President Kamala Harris has promised to be a president for all and ""put country above party"" in the wake of President Biden's controversial ""garbage"" comment. CBS News campaign reporter Nidia Cavazos has more on Harris' campaign.",https://www.cbsnews.com/video/kamala-harris-pledges-to-be-president-for-all-americans-after-bidens-garbage-gaffe/,Campaign
Harris campaigns in Philadelphia as Trump rallies in New York City,"Vice President Kamala Harris hit several stops at she campaigned across Philadelphia on Sunday. Former President Donald Trump, meanwhile, held a rally at Madison Square Garden. Weijia Jiang has more on the campaigns.",https://www.cbsnews.com/video/harris-campaigns-in-philadelphia-as-trump-rallies-in-new-york-city/,Campaign
Will Harris' Trump fascist comments resonate with undecided voters?,Vice President Kamala Harris is ramping up her attacks against former President Donald Trump as she courts voters from battleground states that may still be undecided. CBS News political director Fin Gómez has more.,https://www.cbsnews.com/video/will-harris-trump-fascist-comments-resonate-with-undecided-voters/,Campaign
Harris to give closing argument in D.C. as Trump campaigns in Pennsylvania,"Seven days before Election Day, former President Donald Trump will have rallies in Pennsylvania while Vice President Kamala Harris will give a speech at the park south of the White House.",https://www.cbsnews.com/live-updates/election-day-2024-week-away-trump-harris/,Campaign
Trump and Harris make final appeals in Georgia as polls show tight race,"As the presidential race tightens, former President Donald Trump and Vice President Kamala Harris campaign in Georgia, where our battleground tracker indicates a narrow lead for Trump. CBS News' Nikole Killion has more from Atlanta.",https://www.cbsnews.com/video/trump-and-harris-make-final-appeals-in-georgia-as-polls-show-tight-race/,Campaign
Eye Opener: Donald Trump and Kamala Harris step up campaigns in Pennsylvania,"With just three weeks until Election Day, former President Donald Trump and Vice President Kamala Harris step up their attacks in Pennsylvania. Plus, a man faces charges in North Carolina for allegedly threatening FEMA workers. All that and all that matters i…",https://www.cbsnews.com/video/eye-opener-donald-trump-and-kamala-harris-step-up-campaigns-in-pennsylvania/,Campaign
"Liz Cheney back on campaign trail with Kamala Harris, Obama joining Walz in Wisconsin","With two weeks to go until Election Day, Kamala Harris and Tim Walz are getting help on the campaign trail from Liz Cheney and Barack Obama. Cheney and Harris hit Pennsylvania, Michigan and Wisconsin Monday while Obama will be with Walz in Wisconsin Tuesday. …",https://www.cbsnews.com/video/liz-cheney-back-on-campaign-trail-with-kamala-harris-in-effort-to-appeal-to-republicans/,Campaign
"Kamala Harris delivers closing argument, pledging unity as Election Day nears","Speaking in the same spot where former President Donald Trump addressed supporters on Jan. 6, Vice President Kamala Harris focused on her goal of making progress through national unity, pledging to be a president for all Americans. As Harris delivered that sp…",https://www.cbsnews.com/video/kamala-harris-delivers-closing-argument-pledging-unity-as-election-day-nears/,Campaign
Kamala Harris’ sit-down with Fox News was more sparring match than interview,Vice President Kamala Harris interview with Fox News' Bret Baier was more combative than substantive.,https://www.msnbc.com/opinion/msnbc-opinion/kamala-harris-fox-news-interview-bret-baier-rcna175823,Campaign
Kamala Harris' Fox News appearance is a lesson for Democrats,"Kamala Harris' Fox News interview with Bret Baier is a lesson for Democrats — and for Donald Trump.   With weeks until Election Day, find voters where they are.",https://www.msnbc.com/inside-with-jen-psaki/kamala-harris-fox-news-appearance-lesson-democrats-rcna176151,Campaign
Harris says Trump has no idea what he's talking about when it comes to women's health care,Kamala Harris held a rally in Wisconsin Thursday night where she mocked Donald Trump for his recent comments about IVF and said the former president has no idea what he's talking about on women's health care in America. CBS News campaign reporter Aaron Navarr…,https://www.cbsnews.com/video/harris-says-trump-has-no-idea-what-hes-talking-about-when-it-comes-to-womens-health-care/,Campaign
Harris campaigns with Lizzo in Detroit and Usher in Atlanta,"Vice President Kamala Harris held a campaign rally Saturday morning with musician Lizzo in Detroit, Michigan, before holding another with singer Usher on Saturday night in Atlanta, Georgia, a state where early voting broke a record this week and continues to …",https://www.cbsnews.com/video/harris-campaigns-with-lizzo-in-detroit-and-usher-in-atlanta/,Campaign
"Harris taping interviews, Trump holding roundtable and rally","With exactly two weeks until Election Day, Vice President Kamala Harris is in Washington, D.C., for multiple one-on-one interviews with media outlets. Meanwhile, former President Donald Trump is holding events in North Carolina and Florida. CBS News' Nancy Co…",https://www.cbsnews.com/video/harris-taping-interviews-trump-holding-roundtable-rally/,Campaign
"Harris calls Trump ""unstable and unhinged"" over ""enemy from within"" remarks","Vice President Kamala Harris delivered what may be her sharpest attack yet on former President Donald Trump during her rally in Erie, Pennsylvania, Monday night. Harris slammed Trump over his remarks about the ""enemy from within,"" calling him ""increasingly un…",https://www.cbsnews.com/video/harris-calls-trump-unstable-and-unhinged-over-enemy-from-within-remarks/,Campaign
"Trump takes questions from Latino voters on Univision, Harris does Fox News interview","Both Donald Trump and Kamala Harris are working to reach beyond their respective bases with less than three weeks until Election Day. Wednesday, Trump spoke with Latino voters at a Univision town hall while Harris sat down for an interview with Fox News. CBS …",https://www.cbsnews.com/video/trump-takes-questions-from-latino-voters-on-univision-harris-does-fox-news-interview/,Campaign
"Trump, Harris eye these Pennsylvania counties ahead of 2024 election","Former President Donald Trump and Vice President Kamala Harris are so focused on Pennsylvania before the November election, that they are hoping to flip certain counties there that may have voted differently in the previous cycles. CBS News' Zak Hudak has mor…",https://www.cbsnews.com/video/trump-harris-eye-these-pennsylvania-counties-ahead-of-2024-election/,Campaign
Harris campaigning with Obama in Georgia,"Vice President Kamala Harris was set to share the stage with former President Barack Obama at a campaign rally near Atlanta, Georgia, on Thursday. Also set to attend was Bruce Springsteen, actor Samuel L. Jackson and filmmakers Tyler Perry and Spike Lee. Niko…",https://www.cbsnews.com/video/harris-campaigning-with-obama-in-georgia/,Campaign
"How Trump, Harris are rallying base supporters, focusing on top issues",Former President Donald Trump and Vice President Kamala Harris are focusing some of their efforts before the November election on base supporters with celebrity endorsements and rallies --  Harris will chat abortion and reproductive rights at her Houston rall…,https://www.cbsnews.com/video/trump-harris-rallying-base-supporters-focusing-on-top-issues/,Campaign
