Title,Description,URL,Annotation
Protest over war in Gaza breaks out while Harris campaigns in Michigan,"Vice President Kamala Harris rallied in Michigan Monday, but as she spoke she was again interrupted by a group protesting the war in Gaza. Michigan has the largest percentage of Arab Americans voters, and some Democrats fear support from those voters has slip…",https://www.cbsnews.com/video/protest-over-war-in-gaza-breaks-out-while-harris-campaigns-in-michigan/,Campaign
Candidates go head-to-head in battleground states as Election Day nears,"With one week to go before Election Day, former President Donald Trump and Vice President Kamala Harris take the stage in dueling rallies while campaign rhetoric heats up in key battleground states. Political contributors Leslie Sanchez, Terry Sullivan and Jo…",https://www.cbsnews.com/video/candidates-go-head-to-head-in-battleground-states-as-election-day-nears/,Campaign
Harris seeks to energize first-time voters as election nears,"Vice President Kamala Harris is planning to visit every battleground state in the final week before the election as she places special focus on women and first-time voters. ""CBS Evening News"" anchor and managing editor Norah O'Donnell joins Harris on the camp…",https://www.cbsnews.com/video/harris-seeks-to-energize-first-time-voters-as-election-nears/,Campaign
Harris to give closing message at Ellipse in D.C.,"Vice President Kamala Harris was set to deliver a speech Tuesday evening to thousands of supporters at the Ellipse in Washington, D.C., the same park where former President Donald Trump spoke ahead of the Capitol insurrection on Jan. 6, 2021. She is expected …",https://www.cbsnews.com/video/harris-to-give-closing-message-at-ellipse-in-d-c/,Campaign
"In closing message at Ellipse in D.C., Harris calls Trump ""unstable""","Vice President Kamala Harris delivered a speech Tuesday evening to thousands of supporters at the Ellipse in Washington, D.C., the same park where former President Donald Trump spoke ahead of the Capitol insurrection on Jan. 6, 2021. She told voters that Trum…",https://www.cbsnews.com/video/harris-gives-closing-message-at-ellipse-in-d-c/,Campaign
Harris and Trump hold dueling events in Pennsylvania,Both Kamala Harris and Donald Trump are campaigning Monday night in what some argue is the most important battleground state in this election. The former president is hosting a town hall just outside of Philadelphia while the vice president is holding a rally…,https://www.cbsnews.com/video/harris-trump-hold-dueling-events-pennsylvania/,Campaign
Harris to Pennsylvania as she tries to win over Latino voters leaning for Trump,Vice President Kamala Harris is holding another event in the key battleground state of Pennsylvania. This comes as Harris' campaign moves to reach Latino voters who may be considering the economy and former President Donald Trump as a better choice on that el…,https://www.cbsnews.com/video/harris-to-pennsylvania-as-she-tries-to-win-over-latino-voters-leaning-for-trump/,Campaign
Harris tries to win over undecided and independent voters in key battleground states,"As the 2024 campaign enters its final stretch, Vice President Kamala Harris is focusing on former President Donald Trump's policies and in Michigan, she made an attempt to win over the state's Arab American population. She hits the campaign trail later this w…",https://www.cbsnews.com/video/harris-tries-to-win-over-undecided-and-independent-voters-in-key-battleground-states/,Campaign
"Harris, Trump trade barbs while campaigning in Michigan","Vice President Kamala Harris and former President Donald Trump held several campaign events in the battleground state of Michigan Friday. Speaking in Grand Rapids, Harris touted her support for union labor, while Trump has taken an unusual tack by criticizing…",https://www.cbsnews.com/video/harris-trump-trade-barbs-while-campaigning-in-michigan/,Campaign
"Trump vows to help Helene survivors, Harris slams former president on Cheney tour","Former President Donald Trump is touring Hurricane Helene damage in North Carolina where he is also seeking the support of Christian voters in the battleground state. This comes as Vice President Kamala Harris tours several states with former Rep. Liz Cheney,…",https://www.cbsnews.com/video/trump-vows-to-help-helene-survivors-harris-slams-former-president-on-cheney-tour/,Campaign
"Harris in Wisconsin for youth vote, Trump to Catholic charity dinner","Vice President Kamala Harris is courting the youth vote at several stops in Wisconsin, and former President Donald Trump is attending a Catholic charity dinner in New York with a historic past. CBS News campaign reporters Nidia Cavazos and Jake Rosen have mor…",https://www.cbsnews.com/video/harris-in-wisconsin-for-youth-vote-trump-to-catholic-charity-dinner/,Campaign
Harris works to reach young voters,"As Vice President Kamala Harris' campaign spends tens of millions of dollars across social media to reach young voters, Harris campaigned in Wisconsin Thursday, trying to convince college students in La Crosse she has a plan to boost the economy. Ed O'Keefe r…",https://www.cbsnews.com/video/harris-works-to-reach-young-voters/,Campaign
"Trump, Harris rally in key states 12 days from Election Day","On Thursday, former President Donald Trump is setting his sights on the battleground states of Arizona and Nevada, both of which he lost in 2020. Meanwhile, Vice President Kamala Harris is also looking to energize her base with a star-studded rally in Georgia…",https://www.cbsnews.com/video/trump-harris-rally-key-states-12-days-from-election-day/,Campaign
Candidates turn focus to Black male voters with Election Day around the corner,"As Vice President Kamala Harris and former President Trump vie for Black male support, BET's ""Black Men's Summit,"" hosted by D.L. Hughley, features key voices discussing the issues Black men face. Hughley joins ""CBS Mornings Plus"" to share how Tuesday's summi…",https://www.cbsnews.com/video/candidates-turn-focus-to-black-male-voters-with-election-day-around-the-corner/,Campaign
"Trump sticks to usual talking points, Harris to speak at Ellipse about turning the page",Former President Donald Trump addressed some top voter issues while delivering remarks in Florida. This comes on the day Vice President Kamala Harris plans to deliver her closing remarks from the Ellipse park south of the White House. CBS News campaign report…,https://www.cbsnews.com/video/trump-sticks-to-usual-talking-points-harris-will-push-to-turn-the-page/,Campaign
Significance of Harris' closing argument at park where Trump spoke before Jan. 6 attack,"Vice President Kamala Harris will deliver her closing argument Tuesday night at the same location where former President Donald Trump spoke on Jan. 6, 2021, and told his supporters the 2020 election was stolen. CBS News chief election and campaign corresponde…",https://www.cbsnews.com/video/significance-harris-closing-argument-park-trump-spoke-before-jan-6-attack/,Campaign
Harris campaign reponds to insulting comments at Trump's Madison Square Garden rally,"The inflammatory comments about Puerto Rico at Donald Trump's Madison Square Garden prompted strong reactions from music stars Bad Bunny, Jennifer Lopez and Ricky Martin, with all of them pledging their support for Kamala Harris. CBS News campaign reporter Ni…",https://www.cbsnews.com/video/harris-campaign-reponds-to-insulting-comments-at-trumps-madison-square-garden-rally/,Campaign
Harris campaign hopes to drive young voters to the polls,"In her third battleground stop of the day on Wednesday, Vice President Kamala Harris campaigned in Madison, Wisconsin, focusing on young voter turnout. Polls show Harris has a 23-point advantage over former President Donald Trump among young voters, but they …",https://www.cbsnews.com/video/harris-campaign-hopes-to-drive-young-voters-to-the-polls/,Campaign
Breaking down Harris' final appeal to voters at the Ellipse,"Vice President Kamala Harris on Tuesday gave her ""closing argument"" speech at the Ellipse in Washington, D.C., a week before Election Day, the same park where former President Donald Trump spoke on Jan. 6, 2021, ahead of the Capitol insurrection. Meanwhile, T…",https://www.cbsnews.com/video/breaking-down-harris-final-appeal-voters-ellipse/,Campaign
The state of the 2024 race in two major battleground states,Vice President Kamala Harris and former President Donald Trump spent Thursday in battleground states Arizona and Nevada to try to court voters less than a week from Election Day. CBS News executive director of elections and surveys Anthony Salvanto has more.,https://www.cbsnews.com/video/state-2024-race-two-major-battleground-states/,Campaign
Harris makes final campaign push in West,"Vice President Kamala Harris was campaigning in two critical battleground western states Thursday, hoping Latino voters can help deliver Arizona and Nevada. Polls show that Harris narrowly trails former President Donald Trump in the Grand Canyon State, where …",https://www.cbsnews.com/video/harris-makes-final-campaign-push-in-west/,Campaign
Harris courts Latino voters while campaigning with Jennifer Lopez,"Vice President Kamala Harris made her final stops through the western U.S. for the campaign, where she focused on Latino voters. Jennifer Lopez joined Harris on Thursday in the battleground state of Nevada. Latinos make up 22% of the electorate in Nevada and …",https://www.cbsnews.com/video/harris-courts-latino-voters-while-campaigning-with-jennifer-lopez/,Campaign
"Polls open, Election Day underway after Harris, Trump make final campaign pitches","Vice President Kamala Harris and former President Donald Trump have reached the end of their campaign trails and the polls have opened for Election Day across America. CBS News' Aaron Navarro, Libby Cathey and Fin Gómez have the latest on the candidates' last…",https://www.cbsnews.com/video/polls-open-election-day-underway-after-harris-trump-make-final-campaign-pitches/,Campaign
"As early voting opens in Detroit, Harris, Trump campaign in the battleground state of Michigan","Early voting opened in North Carolina this week, and voters have already cast a record number of ballots, even in the wake of Hurricane Helene. Voting is also set to open in Detroit, a crucial swing state that both Vice President Kamala Harris and former Pres…",https://www.cbsnews.com/video/as-early-voting-opens-in-detroit-harris-trump-campaign-in-the-battleground-state-of-michigan/,Campaign
"Harris, Trump try to shore up support with key voting blocs","Vice President Kamala Harris on Sunday was on the campaign trail in North Carolina, which is still recovering from the devastation of Hurricane Helene. Former President Trump meanwhile was in Arizona to announce a new proposal to expand the Border Patrol. Nik…",https://www.cbsnews.com/video/harris-trump-try-to-shore-up-support-with-key-voting-blocs/,Campaign
"Harris says she's the underdog, Trump compares U.S. to occupied country","Kamala Harris and Donald Trump continued to make their cases to voters on the campaign trail over the weekend, with Harris telling supporters in North Carolina that she's the underdog candidate while Trump compared the U.S. to an occupied country. CBS News ca…",https://www.cbsnews.com/video/harris-says-shes-the-underdog-trump-compares-u-s-to-occupied-country/,Campaign
"Behind Harris' ""blue wall"" strategy as poll numbers show close race with Trump","Vice President Kamala Harris' campaign is ramping up efforts to court voters in the ""blue wall"" states of Pennsylvania, Michigan and Wisconsin as CBS News poll numbers show razor-thin margins in the race against former President Donald Trump in battleground s…",https://www.cbsnews.com/video/behind-harris-blue-wall-strategy-as-poll-numbers-show-close-race-with-trump/,Campaign
Could John Kelly's Trump warning sway voters?,"Between campaign events, Vice President Kamala Harris and former President Donald Trump are reacting to recent comments from Trump's longest-serving chief of staff, John Kelly. In an interview with The New York Times, Kelly said the former president ""certainl…",https://www.cbsnews.com/video/could-john-kelly-trump-warning-sway-voters/,Campaign
Why Harris is working to gain Black men's support,Vice President Kamala Harris interviewed with Charlamagne tha God on Tuesday before her upcoming Fox News interview. Former President Donald Trump took a 39-minute musical break at his unconventional Pennsylvania rally on Monday. CBS News chief Washington cor…,https://www.cbsnews.com/video/why-harris-working-gain-black-mens-support/,Campaign
"Harris, Trump descend on Pennsylvania in closing weeks of 2024 race",Both Vice President Kamala Harris and former President Donald Trump descended on Pennsylvania on Monday. The Keystone State is one of the most crucial battleground states for both candidates this election cycle. CBS News' Major Garrett and Anthony Salvanto jo…,https://www.cbsnews.com/video/harris-trump-descend-pennsylvania-closing-weeks-2024-race/,Campaign
Harris to Nevada to court Latinos before Election Day,"Vice President Kamala Harris will hold a rally in Las Vegas, Nevada, where Latinos could help her campaign's efforts in the battleground state. The economy and immigration are important issues for voters in that state. CBS News' Lilia Luciano previews Harris'…",https://www.cbsnews.com/video/harris-to-nevada-to-court-latinos-before-election-day/,Campaign
Trump campaign under fire for comedian's racist and sexist comments at rally,"Many Republicans are trying to distance themselves from racist and sexist comments that were made at Donald Trump's rally in New York City on Sunday. In addition to Trump's usual attacks on Vice President Kamala Harris, the rally featured a comedian who calle…",https://www.cbsnews.com/video/trump-campaign-under-fire-for-comedians-racist-and-sexist-comments-at-rally/,Campaign
Harris campaigns with Liz Cheney in bipartisan push for voters,"Vice President Kamala Harris looked to broaden her support by campaigning Monday in Wisconsin with Republican Liz Cheney. It was part of a busy day on the campaign trail where Harris hit three battleground states – Pennsylvania, Michigan and Wisconsin. Meanwh…",https://www.cbsnews.com/video/harris-campaigns-with-liz-cheney-in-bipartisan-push-for-voters/,Campaign
Harris bringing out star power in last days of 2024 race,Vice President Kamala Harris is seeking to boost her campaign Thursday night with more star power. She will hold a get-out-the-vote rally in Georgia alongside former President Barack Obama and Bruce Springsteen. CBS News' Nikole Killion and Caitlin Huey-Burns…,https://www.cbsnews.com/video/harris-bringing-out-star-power-last-days-2024-race/,Campaign
"Harris, Trump focus on battleground Georgia as polls show statistical tie in presidential race","Former President Donald Trump made his final stop in Georgia on Sunday night, while Vice President Kamala Harris and Gov. Tim Walz made separate stops in the Peach State over the weekend. President Biden flipped the battleground state in 2020, winning it by f…",https://www.cbsnews.com/video/harris-trump-focus-on-battleground-georgia-as-polls-show-statistical-tie-in-presidential-race/,Campaign
"Eye Opener: Trump, Harris focus on Latino voters in the final days before the election","In the final days before Election Day, Jennifer Lopez is the latest star to stump for Kamala Harris as both presidential candidates reach out to Latino voters. Also, a Danish company is making big profits on weight loss drugs such as Ozempic. All that and all…",https://www.cbsnews.com/video/eye-opener-trump-harris-focus-on-latino-voters-in-the-final-days-before-the-election/,Campaign
"Trump, Harris rally in North Carolina as controversial comments get attention",Former President Donald Trump and Vice President Kamala Harris both addressed crowds in North Carolina Wednesday. This comes after closing arguments from the candidates were clouded by controversial comments made during a Trump rally at Madison Square Garden …,https://www.cbsnews.com/video/trump-harris-rally-in-north-carolina-as-controversial-comments-get-attention/,Campaign
"Harris rally in North Carolina, campaign faces backlash for Biden ""garbage"" comment","Vice President Kamala Harris held a rally in Raleigh, North Carolina, a day after making her closing argument in Washington, D.C. Harris' remarks are being clouded by backlash over President Biden's ""garbage"" comment about Trump supporters during a call with …",https://www.cbsnews.com/video/harris-rally-in-north-carolina-campaign-faces-backlash-for-biden-garbage-comment/,Campaign
Harris seeks to bolster youth vote in campaign's closing days,"Fresh off her massive rally at the Ellipse in Washington, D.C., Vice President Kamala Harris headed back to the battleground states Wednesday, where she was slated to hold a rally in Madison, in an attempt to appeal to the approximately 50,000 college student…",https://www.cbsnews.com/video/harris-seeks-to-bolster-youth-vote-in-campaigns-closing-days/,Campaign
Harris delivers concession address after Trump victory,"Vice President Kamala Harris delivered a concession address Wednesday from her alma mater Howard University after she called President-elect Donald Trump and congratulated him on his victory. Harris told supporters she was ""so proud of the race we ran and the…",https://www.cbsnews.com/video/harris-delivers-concession-address-after-trump-victory/,Campaign
Did Harris' constrained campaign timeline hurt her chances?,"Vice President Kamala Harris has conceded the election to President-elect Donald Trump after running a short but historic presidential campaign. Many Americans might now be wondering: If the Harris had become the Democratic presidential nominee sooner, could …",https://www.cbsnews.com/video/did-harris-constrained-campaign-timeline-hurt-her-chances/,Campaign
"Trump, Harris make play for North Carolina, polls show tight race in the Tar Heel State","Vice President Kamala Harris and former President Donald Trump are making last-minute stops in North Carolina. Though the state has not voted for a Democratic presidential candidate since 2008, the Harris team believes it is still in play while the Trump camp…",https://www.cbsnews.com/video/trump-harris-make-play-for-north-carolina-polls-show-tight-race-in-the-tar-heel-state/,Campaign
"Following ‘exhaustion’ report, Trump cancels yet another appearance","Donald Trump has canceled a surprising number of interviews and appearances lately. The list is still growing, prompting pointed questions from Kamala Harris.",https://www.msnbc.com/rachel-maddow-show/maddowblog/exhaustion-report-trump-cancels-yet-another-appearance-rcna176616,Campaign
Why Harris is taking her campaign to a state she won’t win: Texas,"Kamala Harris will campaign in the Lone Star State, not because she expects to win Texas, but because she wants to shine a light on Texas' abortion ban.",https://www.msnbc.com/rachel-maddow-show/maddowblog/harris-taking-campaign-state-wont-win-texas-rcna177246,Campaign
Why Harris and Beyoncé was a bigger deal than Trump and Joe Rogan,Donald Trump talked to Joe Rogan Friday. Kamala Harris spoke with Beyoncé. The Democrat's appeal to women may prove wiser than the Republican's appeal to bros.,https://www.msnbc.com/opinion/msnbc-opinion/kamala-harris-beyonce-donald-trump-joe-rogan-rcna176699,Campaign
